{
  "$schema": "https://json-schema.org/draft/2020-12/schema",
  "$id": "https://raw.githubusercontent.com/api-evangelist/discogs/refs/heads/main/json-schema/discogs-label-schema.json",
  "title": "Label",
  "description": "Represents a label, company, recording studio, etc.",
  "type": "object",
  "properties": {
    "id": {
      "type": "integer",
      "readOnly": true
    },
    "name": {
      "type": "string"
    },
    "resource_url": {
      "type": "string",
      "format": "uri",
      "readOnly": true
    },
    "uri": {
      "type": "string",
      "format": "uri",
      "readOnly": true
    },
    "releases_url": {
      "type": "string",
      "format": "uri"
    },
    "profile": {
      "type": "string",
      "nullable": true
    },
    "contact_info": {
      "type": "string",
      "nullable": true
    },
    "parent_label": {
      "$ref": "#/components/schemas/LabelSummary",
      "nullable": true
    },
    "sublabels": {
      "type": "array",
      "items": {
        "$ref": "#/components/schemas/LabelSummary"
      }
    },
    "urls": {
      "type": "array",
      "items": {
        "type": "string",
        "format": "uri"
      }
    },
    "images": {
      "type": "array",
      "items": {
        "$ref": "#/components/schemas/Image"
      }
    },
    "data_quality": {
      "type": "string"
    }
  }
}